<?xml version="1.0" encoding="UTF-8"?>
<ab-forms-config xmlns:vc="http://www.w3.org/2007/XMLSchema-versioning"
 xmlns:xsi="http://www.w3.org/2001/XMLSchema-instance"
 xsi:noNamespaceSchemaLocation="file:/E:/exito/ArtifactBuilder/ab-build/config-schema/form-config-schema.xsd">
    <metadata>
        <generatorKey>generatorKey0</generatorKey>
        <generatorComponent>generatorComponent0</generatorComponent>
        <title>title0</title>
    </metadata>
    <form>
        <formId>formId0</formId>
        <formTitle>formTitle0</formTitle>
        <formFunction>formFunction0</formFunction>
        <formElements>
            <inputGroup>
                <groupTitle>groupTitle0</groupTitle>
                <inputs>
                    <text>
                        <label>label0</label>
                        <valueKey>valueKey0</valueKey>
                    </text>
                    <number>
                        <label>label1</label>
                        <valueKey>valueKey1</valueKey>
                    </number>
                    <checkbox>
                        <label>label2</label>
                        <valueKey>valueKey1</valueKey>
                    </checkbox>
                    <file>
                        <label>label3</label>
                        <valueKey>valueKey3</valueKey>
                    </file>
                    <choice>
                        <label>label4</label>
                        <valueKey>valueKey4</valueKey>
                        <options>
                            <option>option0</option>
                        </options>
                    </choice>
                </inputs>
            </inputGroup>
        </formElements>
<!--        <generationRequestFileForm>
        </generationRequestFileForm>-->
    </form>
</ab-forms-config>
